title,abstract,url
Mechanistic Insights into Grokking from the Embedding Layer,"Grokking, a delayed generalization in neural networks after perfect training
performance, has been observed in Transformers and MLPs, but the components
driving it remain underexplored. We show that embeddings are central to
grokking: introducing them into MLPs induces delayed generalization in modular
arithmetic tasks, whereas MLPs without embeddings can generalize immediately.
Our analysis identifies two key mechanisms: (1) Embedding update dynamics,
where rare tokens stagnate due to sparse gradient updates and weight decay, and
(2) Bilinear coupling, where the interaction between embeddings and downstream
weights introduces saddle points and increases sensitivity to initialization.
To confirm these mechanisms, we investigate frequency-aware sampling, which
balances token updates by minimizing gradient variance, and embedding-specific
learning rates, derived from the asymmetric curvature of the bilinear loss
landscape. We prove that an adaptive learning rate ratio,
\(\frac{\eta_E}{\eta_W} \propto \frac{\sigma_{\max}(E)}{\sigma_{\max}(W)} \cdot
\frac{f_W}{f_E}\), mitigates bilinear coupling effects, accelerating
convergence. Our methods not only improve grokking dynamics but also extend to
broader challenges in Transformer optimization, where bilinear interactions
hinder efficient training.",http://arxiv.org/abs/2505.15624v1
Can LLMs $\textit{understand}$ Math? -- Exploring the Pitfalls in Mathematical Reasoning,"Large language models (LLMs) demonstrate considerable potential in various
natural language tasks but face significant challenges in mathematical
reasoning, particularly in executing precise, multi-step logic. However,
current evaluation frameworks judge their performance solely based on accuracy,
which only accounts for the final answer. This study explores these pitfalls by
employing a novel evaluation framework. We propose an evaluation metric called
the MAPLE score, which holistically quantifies reasoning misalignment by
integrating error rates, redundancy, and validity.",http://arxiv.org/abs/2505.15623v1
Benchmarking Energy and Latency in TinyML: A Novel Method for Resource-Constrained AI,"The rise of IoT has increased the need for on-edge machine learning, with
TinyML emerging as a promising solution for resource-constrained devices such
as MCU. However, evaluating their performance remains challenging due to
diverse architectures and application scenarios. Current solutions have many
non-negligible limitations. This work introduces an alternative benchmarking
methodology that integrates energy and latency measurements while
distinguishing three execution phases pre-inference, inference, and
post-inference. Additionally, the setup ensures that the device operates
without being powered by an external measurement unit, while automated testing
can be leveraged to enhance statistical significance. To evaluate our setup, we
tested the STM32N6 MCU, which includes a NPU for executing neural networks. Two
configurations were considered: high-performance and Low-power. The variation
of the EDP was analyzed separately for each phase, providing insights into the
impact of hardware configurations on energy efficiency. Each model was tested
1000 times to ensure statistically relevant results. Our findings demonstrate
that reducing the core voltage and clock frequency improve the efficiency of
pre- and post-processing without significantly affecting network execution
performance. This approach can also be used for cross-platform comparisons to
determine the most efficient inference platform and to quantify how pre- and
post-processing overhead varies across different hardware implementations.",http://arxiv.org/abs/2505.15622v1
Learn to Reason Efficiently with Adaptive Length-based Reward Shaping,"Large Reasoning Models (LRMs) have shown remarkable capabilities in solving
complex problems through reinforcement learning (RL), particularly by
generating long reasoning traces. However, these extended outputs often exhibit
substantial redundancy, which limits the efficiency of LRMs. In this paper, we
investigate RL-based approaches to promote reasoning efficiency. Specifically,
we first present a unified framework that formulates various efficient
reasoning methods through the lens of length-based reward shaping. Building on
this perspective, we propose a novel Length-bAsed StEp Reward shaping method
(LASER), which employs a step function as the reward, controlled by a target
length. LASER surpasses previous methods, achieving a superior Pareto-optimal
balance between performance and efficiency. Next, we further extend LASER based
on two key intuitions: (1) The reasoning behavior of the model evolves during
training, necessitating reward specifications that are also adaptive and
dynamic; (2) Rather than uniformly encouraging shorter or longer chains of
thought (CoT), we posit that length-based reward shaping should be
difficulty-aware i.e., it should penalize lengthy CoTs more for easy queries.
This approach is expected to facilitate a combination of fast and slow
thinking, leading to a better overall tradeoff. The resulting method is termed
LASER-D (Dynamic and Difficulty-aware). Experiments on
DeepSeek-R1-Distill-Qwen-1.5B, DeepSeek-R1-Distill-Qwen-7B, and
DeepSeek-R1-Distill-Qwen-32B show that our approach significantly enhances both
reasoning performance and response length efficiency. For instance, LASER-D and
its variant achieve a +6.1 improvement on AIME2024 while reducing token usage
by 63%. Further analysis reveals our RL-based compression produces more concise
reasoning patterns with less redundant ""self-reflections"". Resources are at
https://github.com/hkust-nlp/Laser.",http://arxiv.org/abs/2505.15612v1
Deep Learning for Continuous-time Stochastic Control with Jumps,"In this paper, we introduce a model-based deep-learning approach to solve
finite-horizon continuous-time stochastic control problems with jumps. We
iteratively train two neural networks: one to represent the optimal policy and
the other to approximate the value function. Leveraging a continuous-time
version of the dynamic programming principle, we derive two different training
objectives based on the Hamilton-Jacobi-Bellman equation, ensuring that the
networks capture the underlying stochastic dynamics. Empirical evaluations on
different problems illustrate the accuracy and scalability of our approach,
demonstrating its effectiveness in solving complex, high-dimensional stochastic
control tasks.",http://arxiv.org/abs/2505.15602v1
Beyond Classification: Evaluating Diffusion Denoised Smoothing for Security-Utility Trade off,"While foundation models demonstrate impressive performance across various
tasks, they remain vulnerable to adversarial inputs. Current research explores
various approaches to enhance model robustness, with Diffusion Denoised
Smoothing emerging as a particularly promising technique. This method employs a
pretrained diffusion model to preprocess inputs before model inference. Yet,
its effectiveness remains largely unexplored beyond classification. We aim to
address this gap by analyzing three datasets with four distinct downstream
tasks under three different adversarial attack algorithms. Our findings reveal
that while foundation models maintain resilience against conventional
transformations, applying high-noise diffusion denoising to clean images
without any distortions significantly degrades performance by as high as 57%.
Low-noise diffusion settings preserve performance but fail to provide adequate
protection across all attack types. Moreover, we introduce a novel attack
strategy specifically targeting the diffusion process itself, capable of
circumventing defenses in the low-noise regime. Our results suggest that the
trade-off between adversarial robustness and performance remains a challenge to
be addressed.",http://arxiv.org/abs/2505.15594v1
World Models as Reference Trajectories for Rapid Motor Adaptation,"Deploying learned control policies in real-world environments poses a
fundamental challenge. When system dynamics change unexpectedly, performance
degrades until models are retrained on new data. We introduce Reflexive World
Models (RWM), a dual control framework that uses world model predictions as
implicit reference trajectories for rapid adaptation. Our method separates the
control problem into long-term reward maximization through reinforcement
learning and robust motor execution through rapid latent control. This dual
architecture achieves significantly faster adaptation with low online
computational cost compared to model-based RL baselines, while maintaining
near-optimal performance. The approach combines the benefits of flexible policy
learning through reinforcement learning with rapid error correction
capabilities, providing a principled approach to maintaining performance in
high-dimensional continuous control tasks under varying dynamics.",http://arxiv.org/abs/2505.15589v1
MIRB: Mathematical Information Retrieval Benchmark,"Mathematical Information Retrieval (MIR) is the task of retrieving
information from mathematical documents and plays a key role in various
applications, including theorem search in mathematical libraries, answer
retrieval on math forums, and premise selection in automated theorem proving.
However, a unified benchmark for evaluating these diverse retrieval tasks has
been lacking. In this paper, we introduce MIRB (Mathematical Information
Retrieval Benchmark) to assess the MIR capabilities of retrieval models. MIRB
includes four tasks: semantic statement retrieval, question-answer retrieval,
premise retrieval, and formula retrieval, spanning a total of 12 datasets. We
evaluate 13 retrieval models on this benchmark and analyze the challenges
inherent to MIR. We hope that MIRB provides a comprehensive framework for
evaluating MIR systems and helps advance the development of more effective
retrieval models tailored to the mathematical domain.",http://arxiv.org/abs/2505.15585v1
Federated Learning with Unlabeled Clients: Personalization Can Happen in Low Dimensions,"Personalized federated learning has emerged as a popular approach to training
on devices holding statistically heterogeneous data, known as clients. However,
most existing approaches require a client to have labeled data for training or
finetuning in order to obtain their own personalized model. In this paper we
address this by proposing FLowDUP, a novel method that is able to generate a
personalized model using only a forward pass with unlabeled data. The generated
model parameters reside in a low-dimensional subspace, enabling efficient
communication and computation. FLowDUP's learning objective is theoretically
motivated by our new transductive multi-task PAC-Bayesian generalization bound,
that provides performance guarantees for unlabeled clients. The objective is
structured in such a way that it allows both clients with labeled data and
clients with only unlabeled data to contribute to the training process. To
supplement our theoretical results we carry out a thorough experimental
evaluation of FLowDUP, demonstrating strong empirical performance on a range of
datasets with differing sorts of statistically heterogeneous clients. Through
numerous ablation studies, we test the efficacy of the individual components of
the method.",http://arxiv.org/abs/2505.15579v1
Visual Perturbation and Adaptive Hard Negative Contrastive Learning for Compositional Reasoning in Vision-Language Models,"Vision-Language Models (VLMs) are essential for multimodal tasks, especially
compositional reasoning (CR) tasks, which require distinguishing fine-grained
semantic differences between visual and textual embeddings. However, existing
methods primarily fine-tune the model by generating text-based hard negative
samples, neglecting the importance of image-based negative samples, which
results in insufficient training of the visual encoder and ultimately impacts
the overall performance of the model. Moreover, negative samples are typically
treated uniformly, without considering their difficulty levels, and the
alignment of positive samples is insufficient, which leads to challenges in
aligning difficult sample pairs. To address these issues, we propose Adaptive
Hard Negative Perturbation Learning (AHNPL). AHNPL translates text-based hard
negatives into the visual domain to generate semantically disturbed image-based
negatives for training the model, thereby enhancing its overall performance.
AHNPL also introduces a contrastive learning approach using a multimodal hard
negative loss to improve the model's discrimination of hard negatives within
each modality and a dynamic margin loss that adjusts the contrastive margin
according to sample difficulty to enhance the distinction of challenging sample
pairs. Experiments on three public datasets demonstrate that our method
effectively boosts VLMs' performance on complex CR tasks. The source code is
available at https://github.com/nynu-BDAI/AHNPL.",http://arxiv.org/abs/2505.15576v1
Bridging the Domain Gap in Equation Distillation with Reinforcement Feedback,"The data-to-equation (Data2Eqn) task aims to discover interpretable
mathematical equations that map observed values to labels, offering physical
insights and broad applicability across academic and industrial domains.
Genetic programming and traditional deep learning-based approaches suffer from
search inefficiency and poor generalization on small task-specific datasets.
Foundation models showed promise in this area, but existing approaches suffer
from: 1) They are pretrained on general-purpose data distributions, making them
less effective for domain-specific tasks; and 2) their training objectives
focus on token-level alignment, overlooking mathematical semantics, which can
lead to inaccurate equations. To address these issues, we aim to enhance the
domain adaptability of foundation models for Data2Eqn tasks. In this work, we
propose a reinforcement learning-based finetuning framework that directly
optimizes the generation policy of a pretrained model through reward signals
derived from downstream numerical fitness. Our method allows the model to adapt
to specific and complex data distributions and generate mathematically
meaningful equations. Extensive experiments demonstrate that our approach
improves both the accuracy and robustness of equation generation under complex
distributions.",http://arxiv.org/abs/2505.15572v1
Refining Neural Activation Patterns for Layer-Level Concept Discovery in Neural Network-Based Receivers,"Concept discovery in neural networks often targets individual neurons or
human-interpretable features, overlooking distributed layer-wide patterns. We
study the Neural Activation Pattern (NAP) methodology, which clusters
full-layer activation distributions to identify such layer-level concepts.
Applied to visual object recognition and radio receiver models, we propose
improved normalization, distribution estimation, distance metrics, and varied
cluster selection. In the radio receiver model, distinct concepts did not
emerge; instead, a continuous activation manifold shaped by Signal-to-Noise
Ratio (SNR) was observed -- highlighting SNR as a key learned factor,
consistent with classical receiver behavior and supporting physical
plausibility. Our enhancements to NAP improved in-distribution vs.
out-of-distribution separation, suggesting better generalization and indirectly
validating clustering quality. These results underscore the importance of
clustering design and activation manifolds in interpreting and troubleshooting
neural network behavior.",http://arxiv.org/abs/2505.15570v1
Impact of Data Sparsity on Machine Learning for Fault Detection in Power System Protection,"Germany's transition to a renewable energy-based power system is reshaping
grid operations, requiring advanced monitoring and control to manage
decentralized generation. Machine learning (ML) has emerged as a powerful tool
for power system protection, particularly for fault detection (FD) and fault
line identification (FLI) in transmission grids. However, ML model reliability
depends on data quality and availability. Data sparsity resulting from sensor
failures, communication disruptions, or reduced sampling rates poses a
challenge to ML-based FD and FLI. Yet, its impact has not been systematically
validated prior to this work. In response, we propose a framework to assess the
impact of data sparsity on ML-based FD and FLI performance. We simulate
realistic data sparsity scenarios, evaluate their impact, derive quantitative
insights, and demonstrate the effectiveness of this evaluation strategy by
applying it to an existing ML-based framework. Results show the ML model
remains robust for FD, maintaining an F1-score of 0.999 $\pm$ 0.000 even after
a 50x data reduction. In contrast, FLI is more sensitive, with performance
decreasing by 55.61% for missing voltage measurements and 9.73% due to
communication failures at critical network points. These findings offer
actionable insights for optimizing ML models for real-world grid protection.
This enables more efficient FD and supports targeted improvements in FLI.",http://arxiv.org/abs/2505.15560v1
Robo-DM: Data Management For Large Robot Datasets,"Recent results suggest that very large datasets of teleoperated robot
demonstrations can be used to train transformer-based models that have the
potential to generalize to new scenes, robots, and tasks. However, curating,
distributing, and loading large datasets of robot trajectories, which typically
consist of video, textual, and numerical modalities - including streams from
multiple cameras - remains challenging. We propose Robo-DM, an efficient
open-source cloud-based data management toolkit for collecting, sharing, and
learning with robot data. With Robo-DM, robot datasets are stored in a
self-contained format with Extensible Binary Meta Language (EBML). Robo-DM can
significantly reduce the size of robot trajectory data, transfer costs, and
data load time during training. Compared to the RLDS format used in OXE
datasets, Robo-DM's compression saves space by up to 70x (lossy) and 3.5x
(lossless). Robo-DM also accelerates data retrieval by load-balancing video
decoding with memory-mapped decoding caches. Compared to LeRobot, a framework
that also uses lossy video compression, Robo-DM is up to 50x faster when
decoding sequentially. We physically evaluate a model trained by Robo-DM with
lossy compression, a pick-and-place task, and In-Context Robot Transformer.
Robo-DM uses 75x compression of the original dataset and does not suffer
reduction in downstream task accuracy.",http://arxiv.org/abs/2505.15558v1
Modular Jump Gaussian Processes,"Gaussian processes (GPs) furnish accurate nonlinear predictions with
well-calibrated uncertainty. However, the typical GP setup has a built-in
stationarity assumption, making it ill-suited for modeling data from processes
with sudden changes, or ""jumps"" in the output variable. The ""jump GP"" (JGP) was
developed for modeling data from such processes, combining local GPs and latent
""level"" variables under a joint inferential framework. But joint modeling can
be fraught with difficulty. We aim to simplify by suggesting a more modular
setup, eschewing joint inference but retaining the main JGP themes: (a)
learning optimal neighborhood sizes that locally respect manifolds of
discontinuity; and (b) a new cluster-based (latent) feature to capture regions
of distinct output levels on both sides of the manifold. We show that each of
(a) and (b) separately leads to dramatic improvements when modeling processes
with jumps. In tandem (but without requiring joint inference) that benefit is
compounded, as illustrated on real and synthetic benchmark examples from the
recent literature.",http://arxiv.org/abs/2505.15557v1
Short-Range Dependency Effects on Transformer Instability and a Decomposed Attention Solution,"Transformer language models have driven significant progress across various
fields, including natural language processing and computer vision. A central
component of these models is the self-attention (SA) mechanism, which learns
rich vector representations of tokens by modeling their relationships with
others in a sequence. However, despite extensive research, transformers
continue to suffer from training instability -- often manifesting as spikes or
divergence in the training loss during a run.
  In this work, we identify one source of this instability: SA's limited
ability to capture short-range dependencies, especially in tasks like language
modeling, where almost every token heavily relies on its nearby neighbors. This
limitation causes the pre-softmax logits of SA to grow rapidly, destabilizing
training. To address this, we propose decomposing the SA into local
(short-range) and global (long-range) attention heads. This decomposed
attention, referred to as Long Short-attention (LS-attention), mitigates logit
explosion and results in more stable training compared to an equivalent
multi-head self-attention (MHSA). Empirical comparisons with two alternative
training stabilization methods show that LS-attention reduces the validation
perplexity to nearly 2/5 of that achieved by one method and reaches a similar
perplexity as the other method using only 1/20 of the GPU hours. Additionally,
our experiments demonstrate that LS-attention reduces inference latency by up
to 36% compared to a state-of-the-art implementation of equivalent MHSA.",http://arxiv.org/abs/2505.15548v1
"Oversmoothing, ""Oversquashing"", Heterophily, Long-Range, and more: Demystifying Common Beliefs in Graph Machine Learning","After a renaissance phase in which researchers revisited the message-passing
paradigm through the lens of deep learning, the graph machine learning
community shifted its attention towards a deeper and practical understanding of
message-passing's benefits and limitations. In this position paper, we notice
how the fast pace of progress around the topics of oversmoothing and
oversquashing, the homophily-heterophily dichotomy, and long-range tasks, came
with the consolidation of commonly accepted beliefs and assumptions that are
not always true nor easy to distinguish from each other. We argue that this has
led to ambiguities around the investigated problems, preventing researchers
from focusing on and addressing precise research questions while causing a good
amount of misunderstandings. Our contribution wants to make such common beliefs
explicit and encourage critical thinking around these topics, supported by
simple but noteworthy counterexamples. The hope is to clarify the distinction
between the different issues and promote separate but intertwined research
directions to address them.",http://arxiv.org/abs/2505.15547v1
A Temporal Difference Method for Stochastic Continuous Dynamics,"For continuous systems modeled by dynamical equations such as ODEs and SDEs,
Bellman's principle of optimality takes the form of the Hamilton-Jacobi-Bellman
(HJB) equation, which provides the theoretical target of reinforcement learning
(RL). Although recent advances in RL successfully leverage this formulation,
the existing methods typically assume the underlying dynamics are known a
priori because they need explicit access to the coefficient functions of
dynamical equations to update the value function following the HJB equation. We
address this inherent limitation of HJB-based RL; we propose a model-free
approach still targeting the HJB equation and propose the corresponding
temporal difference method. We demonstrate its potential advantages over
transition kernel-based formulations, both qualitatively and empirically. The
proposed formulation paves the way toward bridging stochastic optimal control
and model-free reinforcement learning.",http://arxiv.org/abs/2505.15544v2
Robo2VLM: Visual Question Answering from Large-Scale In-the-Wild Robot Manipulation Datasets,"Vision-Language Models (VLMs) acquire real-world knowledge and general
reasoning ability through Internet-scale image-text corpora. They can augment
robotic systems with scene understanding and task planning, and assist
visuomotor policies that are trained on robot trajectory data. We explore the
reverse paradigm - using rich, real, multi-modal robot trajectory data to
enhance and evaluate VLMs. In this paper, we present Robo2VLM, a Visual
Question Answering (VQA) dataset generation framework for VLMs. Given a human
tele-operated robot trajectory, Robo2VLM derives ground-truth from non-visual
and non-descriptive sensory modalities, such as end-effector pose, gripper
aperture, and force sensing. Based on these modalities, it segments the robot
trajectory into a sequence of manipulation phases. At each phase, Robo2VLM uses
scene and interaction understanding to identify 3D properties of the robot,
task goal, and the target object. The properties are used to generate
representative VQA queries - images with textural multiple-choice questions -
based on spatial, goal-conditioned, and interaction reasoning question
templates. We curate Robo2VLM-1, a large-scale in-the-wild dataset with 684,710
questions covering 463 distinct scenes and 3,396 robotic manipulation tasks
from 176k real robot trajectories. Results suggest that Robo2VLM-1 can
benchmark and improve VLM capabilities in spatial and interaction reasoning.",http://arxiv.org/abs/2505.15517v1
