title,abstract,url
Better Rates for Private Linear Regression in the Proportional Regime via Aggressive Clipping,"Differentially private (DP) linear regression has received significant
attention in the recent theoretical literature, with several works aimed at
obtaining improved error rates. A common approach is to set the clipping
constant much larger than the expected norm of the per-sample gradients. While
simplifying the analysis, this is however in sharp contrast with what empirical
evidence suggests to optimize performance. Our work bridges this gap between
theory and practice: we provide sharper rates for DP stochastic gradient
descent (DP-SGD) by crucially operating in a regime where clipping happens
frequently. Specifically, we consider the setting where the data is
multivariate Gaussian, the number of training samples $n$ is proportional to
the input dimension $d$, and the algorithm guarantees constant-order zero
concentrated DP. Our method relies on establishing a deterministic equivalent
for the trajectory of DP-SGD in terms of a family of ordinary differential
equations (ODEs). As a consequence, the risk of DP-SGD is bounded between two
ODEs, with upper and lower bounds matching for isotropic data. By studying
these ODEs when $n / d$ is large enough, we demonstrate the optimality of
aggressive clipping, and we uncover the benefits of decaying learning rate and
private noise scheduling.",http://arxiv.org/abs/2505.16329v1
ChemMLLM: Chemical Multimodal Large Language Model,"Multimodal large language models (MLLMs) have made impressive progress in
many applications in recent years. However, chemical MLLMs that can handle
cross-modal understanding and generation remain underexplored. To fill this
gap, in this paper, we propose ChemMLLM, a unified chemical multimodal large
language model for molecule understanding and generation. Also, we design five
multimodal tasks across text, molecular SMILES strings, and image, and curate
the datasets. We benchmark ChemMLLM against a range of general leading MLLMs
and Chemical LLMs on these tasks. Experimental results show that ChemMLLM
achieves superior performance across all evaluated tasks. For example, in
molecule image optimization task, ChemMLLM outperforms the best baseline
(GPT-4o) by 118.9\% (4.27 vs 1.95 property improvement). The code is publicly
available at https://github.com/bbsbz/ChemMLLM.git.",http://arxiv.org/abs/2505.16326v1
AdaSTaR: Adaptive Data Sampling for Training Self-Taught Reasoners,"Self-Taught Reasoners (STaR), synonymously known as Rejection sampling
Fine-Tuning (RFT), is an integral part of the training pipeline of
self-improving reasoning Language Models (LMs). The self-improving mechanism
often employs random observation (data) sampling. However, this results in
trained observation imbalance; inefficiently over-training on solved examples
while under-training on challenging ones. In response, we introduce Adaptive
STaR (AdaSTaR), a novel algorithm that rectifies this by integrating two
adaptive sampling principles: (1) Adaptive Sampling for Diversity: promoting
balanced training across observations, and (2) Adaptive Sampling for
Curriculum: dynamically adjusting data difficulty to match the model's evolving
strength. Across six benchmarks, AdaSTaR achieves best test accuracy in all
instances (6/6) and reduces training FLOPs by an average of 58.6% against an
extensive list of baselines. These improvements in performance and efficiency
generalize to different pre-trained LMs and larger models, paving the way for
more efficient and effective self-improving LMs.",http://arxiv.org/abs/2505.16322v1
Learning novel representations of variable sources from multi-modal $\textit{Gaia}$ data via autoencoders,"Gaia Data Release 3 (DR3) published for the first time epoch photometry,
BP/RP (XP) low-resolution mean spectra, and supervised classification results
for millions of variable sources. This extensive dataset offers a unique
opportunity to study their variability by combining multiple Gaia data
products. In preparation for DR4, we propose and evaluate a machine learning
methodology capable of ingesting multiple Gaia data products to achieve an
unsupervised classification of stellar and quasar variability. A dataset of 4
million Gaia DR3 sources is used to train three variational autoencoders (VAE),
which are artificial neural networks (ANNs) designed for data compression and
generation. One VAE is trained on Gaia XP low-resolution spectra, another on a
novel approach based on the distribution of magnitude differences in the Gaia G
band, and the third on folded Gaia G band light curves. Each Gaia source is
compressed into 15 numbers, representing the coordinates in a 15-dimensional
latent space generated by combining the outputs of these three models. The
learned latent representation produced by the ANN effectively distinguishes
between the main variability classes present in Gaia DR3, as demonstrated
through both supervised and unsupervised classification analysis of the latent
space. The results highlight a strong synergy between light curves and
low-resolution spectral data, emphasising the benefits of combining the
different Gaia data products. A two-dimensional projection of the latent
variables reveals numerous overdensities, most of which strongly correlate with
astrophysical properties, showing the potential of this latent space for
astrophysical discovery. We show that the properties of our novel latent
representation make it highly valuable for variability analysis tasks,
including classification, clustering and outlier detection.",http://arxiv.org/abs/2505.16320v1
FreshRetailNet-50K: A Stockout-Annotated Censored Demand Dataset for Latent Demand Recovery and Forecasting in Fresh Retail,"Accurate demand estimation is critical for the retail business in guiding the
inventory and pricing policies of perishable products. However, it faces
fundamental challenges from censored sales data during stockouts, where
unobserved demand creates systemic policy biases. Existing datasets lack the
temporal resolution and annotations needed to address this censoring effect. To
fill this gap, we present FreshRetailNet-50K, the first large-scale benchmark
for censored demand estimation. It comprises 50,000 store-product time series
of detailed hourly sales data from 898 stores in 18 major cities, encompassing
863 perishable SKUs meticulously annotated for stockout events. The hourly
stock status records unique to this dataset, combined with rich contextual
covariates, including promotional discounts, precipitation, and temporal
features, enable innovative research beyond existing solutions. We demonstrate
one such use case of two-stage demand modeling: first, we reconstruct the
latent demand during stockouts using precise hourly annotations. We then
leverage the recovered demand to train robust demand forecasting models in the
second stage. Experimental results show that this approach achieves a 2.73\%
improvement in prediction accuracy while reducing the systematic demand
underestimation from 7.37\% to near-zero bias. With unprecedented temporal
granularity and comprehensive real-world information, FreshRetailNet-50K opens
new research directions in demand imputation, perishable inventory
optimization, and causal retail analytics. The unique annotation quality and
scale of the dataset address long-standing limitations in retail AI, providing
immediate solutions and a platform for future methodological innovation. The
data (https://huggingface.co/datasets/Dingdong-Inc/FreshRetailNet-50K) and code
(https://github.com/Dingdong-Inc/frn-50k-baseline}) are openly released.",http://arxiv.org/abs/2505.16319v1
Accelerating Targeted Hard-Label Adversarial Attacks in Low-Query Black-Box Settings,"Deep neural networks for image classification remain vulnerable to
adversarial examples -- small, imperceptible perturbations that induce
misclassifications. In black-box settings, where only the final prediction is
accessible, crafting targeted attacks that aim to misclassify into a specific
target class is particularly challenging due to narrow decision regions.
Current state-of-the-art methods often exploit the geometric properties of the
decision boundary separating a source image and a target image rather than
incorporating information from the images themselves. In contrast, we propose
Targeted Edge-informed Attack (TEA), a novel attack that utilizes edge
information from the target image to carefully perturb it, thereby producing an
adversarial image that is closer to the source image while still achieving the
desired target classification. Our approach consistently outperforms current
state-of-the-art methods across different models in low query settings (nearly
70\% fewer queries are used), a scenario especially relevant in real-world
applications with limited queries and black-box access. Furthermore, by
efficiently generating a suitable adversarial example, TEA provides an improved
target initialization for established geometry-based attacks.",http://arxiv.org/abs/2505.16313v1
Generator-Mediated Bandits: Thompson Sampling for GenAI-Powered Adaptive Interventions,"Recent advances in generative artificial intelligence (GenAI) models have
enabled the generation of personalized content that adapts to up-to-date user
context. While personalized decision systems are often modeled using bandit
formulations, the integration of GenAI introduces new structure into otherwise
classical sequential learning problems. In GenAI-powered interventions, the
agent selects a query, but the environment experiences a stochastic response
drawn from the generative model. Standard bandit methods do not explicitly
account for this structure, where actions influence rewards only through
stochastic, observed treatments. We introduce generator-mediated
bandit-Thompson sampling (GAMBITTS), a bandit approach designed for this
action/treatment split, using mobile health interventions with large language
model-generated text as a motivating case study. GAMBITTS explicitly models
both the treatment and reward generation processes, using information in the
delivered treatment to accelerate policy learning relative to standard methods.
We establish regret bounds for GAMBITTS by decomposing sources of uncertainty
in treatment and reward, identifying conditions where it achieves stronger
guarantees than standard bandit approaches. In simulation studies, GAMBITTS
consistently outperforms conventional algorithms by leveraging observed
treatments to more accurately estimate expected rewards.",http://arxiv.org/abs/2505.16311v1
CAIFormer: A Causal Informed Transformer for Multivariate Time Series Forecasting,"Most existing multivariate time series forecasting methods adopt an
all-to-all paradigm that feeds all variable histories into a unified model to
predict their future values without distinguishing their individual roles.
However, this undifferentiated paradigm makes it difficult to identify
variable-specific causal influences and often entangles causally relevant
information with spurious correlations. To address this limitation, we propose
an all-to-one forecasting paradigm that predicts each target variable
separately. Specifically, we first construct a Structural Causal Model from
observational data and then, for each target variable, we partition the
historical sequence into four sub-segments according to the inferred causal
structure: endogenous, direct causal, collider causal, and spurious
correlation. The prediction relies solely on the first three causally relevant
sub-segments, while the spurious correlation sub-segment is excluded.
Furthermore, we propose Causal Informed Transformer (CAIFormer), a novel
forecasting model comprising three components: Endogenous Sub-segment
Prediction Block, Direct Causal Sub-segment Prediction Block, and Collider
Causal Sub-segment Prediction Block, which process the endogenous, direct
causal, and collider causal sub-segments, respectively. Their outputs are then
combined to produce the final prediction. Extensive experiments on multiple
benchmark datasets demonstrate the effectiveness of the CAIFormer.",http://arxiv.org/abs/2505.16308v1
PMPO: Probabilistic Metric Prompt Optimization for Small and Large Language Models,"Prompt optimization offers a practical and broadly applicable alternative to
fine-tuning for improving large language model (LLM) performance. However,
existing methods often rely on costly output generation, self-critiquing
abilities, or human-annotated preferences, which limit their scalability,
especially for smaller or non-instruction-tuned models. We introduce PMPO
(Probabilistic Metric Prompt Optimization), a unified framework that refines
prompts using token-level cross-entropy loss as a direct, lightweight
evaluation signal. PMPO identifies low-quality prompt segments by masking and
measuring their impact on loss, then rewrites and selects improved variants by
minimizing loss over positive and negative examples. Unlike prior methods, it
requires no output sampling or human evaluation during optimization, relying
only on forward passes and log-likelihoods. PMPO supports both supervised and
preference-based tasks through a closely aligned loss-based evaluation
strategy. Experiments show that PMPO consistently outperforms prior methods
across model sizes and tasks: it achieves the highest average accuracy on BBH,
performs strongly on GSM8K and AQUA-RAT, and improves AlpacaEval 2.0 win rates
by over 19 points. These results highlight PMPO's effectiveness, efficiency,
and broad applicability.",http://arxiv.org/abs/2505.16307v1
Large-Scale Bayesian Tensor Reconstruction: An Approximate Message Passing Solution,"Tensor CANDECOMP/PARAFAC decomposition (CPD) is a fundamental model for
tensor reconstruction. Although the Bayesian framework allows for principled
uncertainty quantification and automatic hyperparameter learning, existing
methods do not scale well for large tensors because of high-dimensional matrix
inversions. To this end, we introduce CP-GAMP, a scalable Bayesian CPD
algorithm. This algorithm leverages generalized approximate message passing
(GAMP) to avoid matrix inversions and incorporates an expectation-maximization
routine to jointly infer the tensor rank and noise power. Through multiple
experiments, for synthetic 100x100x100 rank 20 tensors with only 20% elements
observed, the proposed algorithm reduces runtime by 82.7% compared to the
state-of-the-art variational Bayesian CPD method, while maintaining comparable
reconstruction accuracy.",http://arxiv.org/abs/2505.16305v1
Artificial Intelligence for Direct Prediction of Molecular Dynamics Across Chemical Space,"Molecular dynamics (MD) is a powerful tool for exploring the behavior of
atomistic systems, but its reliance on sequential numerical integration limits
simulation efficiency. We present MDtrajNet-1, a foundational AI model that
directly generates MD trajectories across chemical space, bypassing force
calculations and integration. This approach accelerates simulations by up to
two orders of magnitude compared to traditional MD, even those enhanced by
machine-learning interatomic potentials. MDtrajNet-1 combines equivariant
neural networks with a Transformer-based architecture to achieve strong
accuracy and transferability in predicting long-time trajectories for both
known and unseen systems. Remarkably, the errors of the trajectories generated
by MDtrajNet-1 for various molecular systems are close to those of the
conventional ab initio MD. The model's flexible design supports diverse
application scenarios, including different statistical ensembles, boundary
conditions, and interaction types. By overcoming the intrinsic speed barrier of
conventional MD, MDtrajNet-1 opens new frontiers in efficient and scalable
atomistic simulations.",http://arxiv.org/abs/2505.16301v1
Fairness under Competition,"Algorithmic fairness has emerged as a central issue in ML, and it has become
standard practice to adjust ML algorithms so that they will satisfy fairness
requirements such as Equal Opportunity. In this paper we consider the effects
of adopting such fair classifiers on the overall level of ecosystem fairness.
Specifically, we introduce the study of fairness with competing firms, and
demonstrate the failure of fair classifiers in yielding fair ecosystems. Our
results quantify the loss of fairness in systems, under a variety of
conditions, based on classifiers' correlation and the level of their data
overlap. We show that even if competing classifiers are individually fair, the
ecosystem's outcome may be unfair; and that adjusting biased algorithms to
improve their individual fairness may lead to an overall decline in ecosystem
fairness. In addition to these theoretical results, we also provide supporting
experimental evidence. Together, our model and results provide a novel and
essential call for action.",http://arxiv.org/abs/2505.16291v1
Only Large Weights (And Not Skip Connections) Can Prevent the Perils of Rank Collapse,"Attention mechanisms lie at the heart of modern large language models (LLMs).
Straightforward algorithms for forward and backward (gradient) computation take
quadratic time, and a line of work initiated by [Alman and Song NeurIPS 2023]
and [Alman and Song NeurIPS 2024] has shown that quadratic time is necessary
unless the model weights are small, in which case almost linear time algorithms
are possible. In this paper, we show that large weights are necessary to avoid
a strong preclusion to representational strength we call layer collapse, which
means that the entire network can be approximated well by a network with only a
single layer. Thus, the quadratic running time of attention is unavoidable for
expressive transformers.
  The notion of layer collapse that we introduce is a variant on the notion of
rank collapse from the work of [Dong, Cordonnier, and Loukas ICML 2021]. They
showed that in Self Attention Networks with small weights and with skip
connections, rank collapse must occur. This is typically interpreted as
justifying the necessity of skip connections in expressive networks. However,
our result shows that even with skip connections, if the weights are small,
then layer collapse still occurs. Thus, only large weights, and not skip
connections, can prevent these representational weaknesses.",http://arxiv.org/abs/2505.16284v1
Transformer Copilot: Learning from The Mistake Log in LLM Fine-tuning,"Large language models are typically adapted to downstream tasks through
supervised fine-tuning on domain-specific data. While standard fine-tuning
focuses on minimizing generation loss to optimize model parameters, we take a
deeper step by retaining and leveraging the model's own learning signals,
analogous to how human learners reflect on past mistakes to improve future
performance. We first introduce the concept of Mistake Log to systematically
track the model's learning behavior and recurring errors throughout
fine-tuning. Treating the original transformer-based model as the Pilot, we
correspondingly design a Copilot model to refine the Pilot's inference
performance via logits rectification. We name the overall Pilot-Copilot
framework the Transformer Copilot, which introduces (i) a novel Copilot model
design, (ii) a joint training paradigm where the Copilot continuously learns
from the evolving Mistake Log alongside the Pilot, and (iii) a fused inference
paradigm where the Copilot rectifies the Pilot's logits for enhanced
generation. We provide both theoretical and empirical analyses on our new
learning framework. Experiments on 12 benchmarks spanning commonsense,
arithmetic, and recommendation tasks demonstrate that Transformer Copilot
consistently improves performance by up to 34.5%, while introducing marginal
computational overhead to Pilot models and exhibiting strong scalability and
transferability.",http://arxiv.org/abs/2505.16270v1
Think-RM: Enabling Long-Horizon Reasoning in Generative Reward Models,"Reinforcement learning from human feedback (RLHF) has become a powerful
post-training paradigm for aligning large language models with human
preferences. A core challenge in RLHF is constructing accurate reward signals,
where the conventional Bradley-Terry reward models (BT RMs) often suffer from
sensitivity to data size and coverage, as well as vulnerability to reward
hacking. Generative reward models (GenRMs) offer a more robust alternative by
generating chain-of-thought (CoT) rationales followed by a final reward.
However, existing GenRMs rely on shallow, vertically scaled reasoning, limiting
their capacity to handle nuanced or complex (e.g., reasoning-intensive) tasks.
Moreover, their pairwise preference outputs are incompatible with standard RLHF
algorithms that require pointwise reward signals. In this work, we introduce
Think-RM, a training framework that enables long-horizon reasoning in GenRMs by
modeling an internal thinking process. Rather than producing structured,
externally provided rationales, Think-RM generates flexible, self-guided
reasoning traces that support advanced capabilities such as self-reflection,
hypothetical reasoning, and divergent reasoning. To elicit these reasoning
abilities, we first warm-up the models by supervised fine-tuning (SFT) over
long CoT data. We then further improve the model's long-horizon abilities by
rule-based reinforcement learning (RL). In addition, we propose a novel
pairwise RLHF pipeline that directly optimizes policies using pairwise
preference rewards, eliminating the need for pointwise reward conversion and
enabling more effective use of Think-RM outputs. Experiments show that Think-RM
achieves state-of-the-art results on RM-Bench, outperforming both BT RM and
vertically scaled GenRM by 8%. When combined with our pairwise RLHF pipeline,
it demonstrates superior end-policy performance compared to traditional
approaches.",http://arxiv.org/abs/2505.16265v1
"All You Need is ""Leet"": Evading Hate-speech Detection AI","Social media and online forums are increasingly becoming popular.
Unfortunately, these platforms are being used for spreading hate speech. In
this paper, we design black-box techniques to protect users from hate-speech on
online platforms by generating perturbations that can fool state of the art
deep learning based hate speech detection models thereby decreasing their
efficiency. We also ensure a minimal change in the original meaning of
hate-speech. Our best perturbation attack is successfully able to evade
hate-speech detection for 86.8 % of hateful text.",http://arxiv.org/abs/2505.16263v1
Small-to-Large Generalization: Data Influences Models Consistently Across Scale,"Choice of training data distribution greatly influences model behavior. Yet,
in large-scale settings, precisely characterizing how changes in training data
affects predictions is often difficult due to model training costs. Current
practice is to instead extrapolate from scaled down, inexpensive-to-train proxy
models. However, changes in data do not influence smaller and larger models
identically. Therefore, understanding how choice of data affects large-scale
models raises the question: how does training data distribution influence model
behavior across compute scale? We find that small- and large-scale language
model predictions (generally) do highly correlate across choice of training
data. Equipped with these findings, we characterize how proxy scale affects
effectiveness in two downstream proxy model applications: data attribution and
dataset selection.",http://arxiv.org/abs/2505.16260v1
Higher-Order Asymptotics of Test-Time Adaptation for Batch Normalization Statistics,"This study develops a higher-order asymptotic framework for test-time
adaptation (TTA) of Batch Normalization (BN) statistics under distribution
shift by integrating classical Edgeworth expansion and saddlepoint
approximation techniques with a novel one-step M-estimation perspective. By
analyzing the statistical discrepancy between training and test distributions,
we derive an Edgeworth expansion for the normalized difference in BN means and
obtain an optimal weighting parameter that minimizes the mean-squared error of
the adapted statistic. Reinterpreting BN TTA as a one-step M-estimator allows
us to derive higher-order local asymptotic normality results, which incorporate
skewness and other higher moments into the estimator's behavior. Moreover, we
quantify the trade-offs among bias, variance, and skewness in the adaptation
process and establish a corresponding generalization bound on the model risk.
The refined saddlepoint approximations further deliver uniformly accurate
density and tail probability estimates for the BN TTA statistic. These
theoretical insights provide a comprehensive understanding of how higher-order
corrections and robust one-step updating can enhance the reliability and
performance of BN layers in adapting to changing data distributions.",http://arxiv.org/abs/2505.16257v1
