title,abstract,url
"Agentic Feature Augmentation: Unifying Selection and Generation with Teaming, Planning, and Memories","As a widely-used and practical tool, feature engineering transforms raw data
into discriminative features to advance AI model performance. However, existing
methods usually apply feature selection and generation separately, failing to
strive a balance between reducing redundancy and adding meaningful dimensions.
To fill this gap, we propose an agentic feature augmentation concept, where the
unification of feature generation and selection is modeled as agentic teaming
and planning. Specifically, we develop a Multi-Agent System with Long and
Short-Term Memory (MAGS), comprising a selector agent to eliminate redundant
features, a generator agent to produce informative new dimensions, and a router
agent that strategically coordinates their actions. We leverage in-context
learning with short-term memory for immediate feedback refinement and long-term
memory for globally optimal guidance. Additionally, we employ offline Proximal
Policy Optimization (PPO) reinforcement fine-tuning to train the router agent
for effective decision-making to navigate a vast discrete feature space.
Extensive experiments demonstrate that this unified agentic framework
consistently achieves superior task performance by intelligently orchestrating
feature selection and generation.",http://arxiv.org/abs/2505.15076v1
Traveling Across Languages: Benchmarking Cross-Lingual Consistency in Multimodal LLMs,"The rapid evolution of multimodal large language models (MLLMs) has
significantly enhanced their real-world applications. However, achieving
consistent performance across languages, especially when integrating cultural
knowledge, remains a significant challenge. To better assess this issue, we
introduce two new benchmarks: KnowRecall and VisRecall, which evaluate
cross-lingual consistency in MLLMs. KnowRecall is a visual question answering
benchmark designed to measure factual knowledge consistency in 15 languages,
focusing on cultural and historical questions about global landmarks. VisRecall
assesses visual memory consistency by asking models to describe landmark
appearances in 9 languages without access to images. Experimental results
reveal that state-of-the-art MLLMs, including proprietary ones, still struggle
to achieve cross-lingual consistency. This underscores the need for more robust
approaches that produce truly multilingual and culturally aware models.",http://arxiv.org/abs/2505.15075v1
DISCO Balances the Scales: Adaptive Domain- and Difficulty-Aware Reinforcement Learning on Imbalanced Data,"Large Language Models (LLMs) are increasingly aligned with human preferences
through Reinforcement Learning from Human Feedback (RLHF). Among RLHF methods,
Group Relative Policy Optimization (GRPO) has gained attention for its
simplicity and strong performance, notably eliminating the need for a learned
value function. However, GRPO implicitly assumes a balanced domain distribution
and uniform semantic alignment across groups - assumptions that rarely hold in
real-world datasets. When applied to multi-domain, imbalanced data, GRPO
disproportionately optimizes for dominant domains, neglecting underrepresented
ones and resulting in poor generalization and fairness. We propose
Domain-Informed Self-Consistency Policy Optimization (DISCO), a principled
extension to GRPO that addresses inter-group imbalance with two key
innovations. Domain-aware reward scaling counteracts frequency bias by
reweighting optimization based on domain prevalence. Difficulty-aware reward
scaling leverages prompt-level self-consistency to identify and prioritize
uncertain prompts that offer greater learning value. Together, these strategies
promote more equitable and effective policy learning across domains. Extensive
experiments across multiple LLMs and skewed training distributions show that
DISCO improves generalization, outperforms existing GRPO variants by 5% on
Qwen3 models, and sets new state-of-the-art results on multi-domain alignment
benchmarks.",http://arxiv.org/abs/2505.15074v1
MoTime: A Dataset Suite for Multimodal Time Series Forecasting,"While multimodal data sources are increasingly available from real-world
forecasting, most existing research remains on unimodal time series. In this
work, we present MoTime, a suite of multimodal time series forecasting datasets
that pair temporal signals with external modalities such as text, metadata, and
images. Covering diverse domains, MoTime supports structured evaluation of
modality utility under two scenarios: 1) the common forecasting task, where
varying-length history is available, and 2) cold-start forecasting, where no
historical data is available. Experiments show that external modalities can
improve forecasting performance in both scenarios, with particularly strong
benefits for short series in some datasets, though the impact varies depending
on data characteristics. By making datasets and findings publicly available, we
aim to support more comprehensive and realistic benchmarks in future multimodal
time series forecasting research.",http://arxiv.org/abs/2505.15072v1
ModelingAgent: Bridging LLMs and Mathematical Modeling for Real-World Challenges,"Recent progress in large language models (LLMs) has enabled substantial
advances in solving mathematical problems. However, existing benchmarks often
fail to reflect the complexity of real-world problems, which demand open-ended,
interdisciplinary reasoning and integration of computational tools. To address
this gap, we introduce ModelingBench, a novel benchmark featuring
real-world-inspired, open-ended problems from math modeling competitions across
diverse domains, ranging from urban traffic optimization to ecosystem resource
planning. These tasks require translating natural language into formal
mathematical formulations, applying appropriate tools, and producing
structured, defensible reports. ModelingBench also supports multiple valid
solutions, capturing the ambiguity and creativity of practical modeling. We
also present ModelingAgent, a multi-agent framework that coordinates tool use,
supports structured workflows, and enables iterative self-refinement to
generate well-grounded, creative solutions. To evaluate outputs, we further
propose ModelingJudge, an expert-in-the-loop system leveraging LLMs as
domain-specialized judges assessing solutions from multiple expert
perspectives. Empirical results show that ModelingAgent substantially
outperforms strong baselines and often produces solutions indistinguishable
from those of human experts. Together, our work provides a comprehensive
framework for evaluating and advancing real-world problem-solving in
open-ended, interdisciplinary modeling challenges.",http://arxiv.org/abs/2505.15068v1
Generalization Through Growth: Hidden Dynamics Controls Depth Dependence,"Recent theory has reduced the depth dependence of generalization bounds from
exponential to polynomial and even depth-independent rates, yet these results
remain tied to specific architectures and Euclidean inputs. We present a
unified framework for arbitrary \blue{pseudo-metric} spaces in which a
depth-\(k\) network is the composition of continuous hidden maps
\(f:\mathcal{X}\to \mathcal{X}\) and an output map \(h:\mathcal{X}\to
\mathbb{R}\). The resulting bound $O(\sqrt{(\alpha + \log \beta(k))/n})$
isolates the sole depth contribution in \(\beta(k)\), the word-ball growth of
the semigroup generated by the hidden layers. By Gromov's theorem polynomial
(resp. exponential) growth corresponds to virtually nilpotent (resp. expanding)
dynamics, revealing a geometric dichotomy behind existing $O(\sqrt{k})$
(sublinear depth) and $\tilde{O}(1)$ (depth-independent) rates. We further
provide covering-number estimates showing that expanding dynamics yield an
exponential parameter saving via compositional expressivity. Our results
decouple specification from implementation, offering architecture-agnostic and
dynamical-systems-aware guarantees applicable to modern deep-learning paradigms
such as test-time inference and diffusion models.",http://arxiv.org/abs/2505.15064v1
Restricted Spectral Gap Decomposition for Simulated Tempering Targeting Mixture Distributions,"Simulated tempering is a widely used strategy for sampling from multimodal
distributions. In this paper, we consider simulated tempering combined with an
arbitrary local Markov chain Monte Carlo sampler and present a new
decomposition theorem that provides a lower bound on the restricted spectral
gap of the algorithm for sampling from mixture distributions. By working with
the restricted spectral gap, the applicability of our results is extended to
broader settings such as when the usual spectral gap is difficult to bound or
becomes degenerate. We demonstrate the application of our theoretical results
by analyzing simulated tempering combined with random walk Metropolis--Hastings
for sampling from mixtures of Gaussian distributions. We show that in
fixed-dimensional settings, the algorithm's complexity scales polynomially with
the separation between modes and logarithmically with $1/\varepsilon$, where
$\varepsilon$ is the target accuracy in total variation distance.",http://arxiv.org/abs/2505.15059v1
"MolLangBench: A Comprehensive Benchmark for Language-Prompted Molecular Structure Recognition, Editing, and Generation","Precise recognition, editing, and generation of molecules are essential
prerequisites for both chemists and AI systems tackling various chemical tasks.
We present MolLangBench, a comprehensive benchmark designed to evaluate
fundamental molecule-language interface tasks: language-prompted molecular
structure recognition, editing, and generation. To ensure high-quality,
unambiguous, and deterministic outputs, we construct the recognition tasks
using automated cheminformatics tools, and curate editing and generation tasks
through rigorous expert annotation and validation. MolLangBench supports the
evaluation of models that interface language with different molecular
representations, including linear strings, molecular images, and molecular
graphs. Evaluations of state-of-the-art models reveal significant limitations:
the strongest model (o3) achieves $79.2\%$ and $78.5\%$ accuracy on recognition
and editing tasks, which are intuitively simple for humans, and performs even
worse on the generation task, reaching only $29.0\%$ accuracy. These results
highlight the shortcomings of current AI systems in handling even preliminary
molecular recognition and manipulation tasks. We hope MolLangBench will
catalyze further research toward more effective and reliable AI systems for
chemical applications.",http://arxiv.org/abs/2505.15054v1
PiFlow: Principle-aware Scientific Discovery with Multi-Agent Collaboration,"Large Language Model (LLM)-based multi-agent systems (MAS) demonstrate
remarkable potential for scientific discovery. Existing approaches, however,
often automate scientific discovery using predefined workflows that lack
rationality constraints. This often leads to aimless hypothesizing and a
failure to consistently link hypotheses with evidence, thereby hindering
systematic uncertainty reduction. Overcoming these limitations fundamentally
requires systematic uncertainty reduction. We introduce \texttt{PiFlow}, an
information-theoretical framework, treating automated scientific discovery as a
structured uncertainty reduction problem guided by principles (e.g., scientific
laws). In evaluations across three distinct scientific domains -- discovering
nanomaterial structures, bio-molecules, and superconductor candidates with
targeted properties -- our method significantly improves discovery efficiency,
reflected by a 73.55\% increase in the Area Under the Curve (AUC) of property
values versus exploration steps, and enhances solution quality by 94.06\%
compared to a vanilla agent system. Overall, \texttt{PiFlow} serves as a
Plug-and-Play method, establishing a novel paradigm shift in highly efficient
automated scientific discovery, paving the way for more robust and accelerated
AI-driven research. Code is publicly available at our
\href{https://github.com/amair-lab/PiFlow}{GitHub}.",http://arxiv.org/abs/2505.15047v1
Learning-based Airflow Inertial Odometry for MAVs using Thermal Anemometers in a GPS and vision denied environment,"This work demonstrates an airflow inertial based odometry system with
multi-sensor data fusion, including thermal anemometer, IMU, ESC, and
barometer. This goal is challenging because low-cost IMUs and barometers have
significant bias, and anemometer measurements are very susceptible to
interference from spinning propellers and ground effects. We employ a GRU-based
deep neural network to estimate relative air speed from noisy and disturbed
anemometer measurements, and an observer with bias model to fuse the sensor
data and thus estimate the state of aerial vehicle. A complete flight data,
including takeoff and landing on the ground, shows that the approach is able to
decouple the downwash induced wind speed caused by propellers and the ground
effect, and accurately estimate the flight speed in a wind-free indoor
environment. IMU, and barometer bias are effectively estimated, which
significantly reduces the position integration drift, which is only 5.7m for
203s manual random flight. The open source is available on
https://github.com/SyRoCo-ISIR/Flight-Speed-Estimation-Airflow.",http://arxiv.org/abs/2505.15044v1
RLBenchNet: The Right Network for the Right Reinforcement Learning Task,"Reinforcement learning (RL) has seen significant advancements through the
application of various neural network architectures. In this study, we
systematically investigate the performance of several neural networks in RL
tasks, including Long Short-Term Memory (LSTM), Multi-Layer Perceptron (MLP),
Mamba/Mamba-2, Transformer-XL, Gated Transformer-XL, and Gated Recurrent Unit
(GRU). Through comprehensive evaluation across continuous control, discrete
decision-making, and memory-based environments, we identify
architecture-specific strengths and limitations. Our results reveal that: (1)
MLPs excel in fully observable continuous control tasks, providing an optimal
balance of performance and efficiency; (2) recurrent architectures like LSTM
and GRU offer robust performance in partially observable environments with
moderate memory requirements; (3) Mamba models achieve a 4.5x higher throughput
compared to LSTM and a 3.9x increase over GRU, all while maintaining comparable
performance; and (4) only Transformer-XL, Gated Transformer-XL, and Mamba-2
successfully solve the most challenging memory-intensive tasks, with Mamba-2
requiring 8x less memory than Transformer-XL. These findings provide insights
for researchers and practitioners, enabling more informed architecture
selection based on specific task characteristics and computational constraints.
Code is available at: https://github.com/SafeRL-Lab/RLBenchNet",http://arxiv.org/abs/2505.15040v1
RL Tango: Reinforcing Generator and Verifier Together for Language Reasoning,"Reinforcement learning (RL) has recently emerged as a compelling approach for
enhancing the reasoning capabilities of large language models (LLMs), where an
LLM generator serves as a policy guided by a verifier (reward model). However,
current RL post-training methods for LLMs typically use verifiers that are
fixed (rule-based or frozen pretrained) or trained discriminatively via
supervised fine-tuning (SFT). Such designs are susceptible to reward hacking
and generalize poorly beyond their training distributions. To overcome these
limitations, we propose Tango, a novel framework that uses RL to concurrently
train both an LLM generator and a verifier in an interleaved manner. A central
innovation of Tango is its generative, process-level LLM verifier, which is
trained via RL and co-evolves with the generator. Importantly, the verifier is
trained solely based on outcome-level verification correctness rewards without
requiring explicit process-level annotations. This generative RL-trained
verifier exhibits improved robustness and superior generalization compared to
deterministic or SFT-trained verifiers, fostering effective mutual
reinforcement with the generator. Extensive experiments demonstrate that both
components of Tango achieve state-of-the-art results among 7B/8B-scale models:
the generator attains best-in-class performance across five competition-level
math benchmarks and four challenging out-of-domain reasoning tasks, while the
verifier leads on the ProcessBench dataset. Remarkably, both components exhibit
particularly substantial improvements on the most difficult mathematical
reasoning problems. Code is at: https://github.com/kaiwenzha/rl-tango.",http://arxiv.org/abs/2505.15034v1
Harnessing On-Device Large Language Model: Empirical Results and Implications for AI PC,"The increasing deployment of Large Language Models (LLMs) on edge devices,
driven by model advancements and hardware improvements, offers significant
privacy benefits. However, these on-device LLMs inherently face performance
limitations due to reduced model capacity and necessary compression techniques.
To address this, we introduce a systematic methodology -- encompassing model
capability, development efficiency, and system resources -- for evaluating
on-device LLMs. Our comprehensive evaluation, encompassing models from 0.5B to
14B parameters and seven post-training quantization (PTQ) methods on commodity
laptops, yields several critical insights: 1) System-level metrics exhibit
near-linear scaling with effective bits-per-weight (BPW). 2) A practical
threshold exists around $\sim$3.5 effective BPW, larger models subjected to
low-bit quantization consistently outperform smaller models utilizing higher
bit-precision. 3) Quantization with low BPW incurs marginal accuracy loss but
significant memory savings. 4) Determined by low-level implementation specifics
power consumption on CPU, where computation-intensive operations spend more
power than memory-intensive ones. These findings offer crucial insights and
practical guidelines for the efficient deployment and optimized configuration
of LLMs on resource-constrained edge devices. Our codebase is available at
https://github.com/simmonssong/LLMOnDevice.",http://arxiv.org/abs/2505.15030v2
Infinite hierarchical contrastive clustering for personal digital envirotyping,"Daily environments have profound influence on our health and behavior. Recent
work has shown that digital envirotyping, where computer vision is applied to
images of daily environments taken during ecological momentary assessment
(EMA), can be used to identify meaningful relationships between environmental
features and health outcomes of interest. To systematically study such effects
on an individual level, it is helpful to group images into distinct
environments encountered in an individual's daily life; these may then be
analyzed, further grouped into related environments with similar features, and
linked to health outcomes. Here we introduce infinite hierarchical contrastive
clustering to address this challenge. Building on the established contrastive
clustering framework, our method a) allows an arbitrary number of clusters
without requiring the full Dirichlet Process machinery by placing a
stick-breaking prior on predicted cluster probabilities; and b) encourages
distinct environments to form well-defined sub-clusters within each cluster of
related environments by incorporating a participant-specific prediction loss.
Our experiments show that our model effectively identifies distinct personal
environments and groups these environments into meaningful environment types.
We then illustrate how the resulting clusters can be linked to various health
outcomes, highlighting the potential of our approach to advance the
envirotyping paradigm.",http://arxiv.org/abs/2505.15022v1
Beyond Node Attention: Multi-Scale Harmonic Encoding for Feature-Wise Graph Message Passing,"Conventional Graph Neural Networks (GNNs) aggregate neighbor embeddings as
holistic vectors, lacking the ability to identify fine-grained,
direction-specific feature relevance. We propose MSH-GNN (Multi-Scale Harmonic
Graph Neural Network), a novel architecture that performs feature-wise adaptive
message passing through node-specific harmonic projections. For each node,
MSH-GNN dynamically projects neighbor features onto frequency-sensitive
directions determined by the target node's own representation. These
projections are further modulated using learnable sinusoidal encodings at
multiple frequencies, enabling the model to capture both smooth and oscillatory
structural patterns across scales. A frequency-aware attention pooling
mechanism is introduced to emphasize spectrally and structurally salient nodes
during readout. Theoretically, we prove that MSH-GNN approximates
shift-invariant kernels and matches the expressive power of the
1-Weisfeiler-Lehman (1-WL) test. Empirically, MSH-GNN consistently outperforms
state-of-the-art models on a wide range of graph and node classification tasks.
Furthermore, in challenging classification settings involving joint variations
in graph topology and spectral frequency, MSH-GNN excels at capturing
structural asymmetries and high-frequency modulations, enabling more accurate
graph discrimination.",http://arxiv.org/abs/2505.15015v1
Convergence of Adam in Deep ReLU Networks via Directional Complexity and Kakeya Bounds,"First-order adaptive optimization methods like Adam are the default choices
for training modern deep neural networks. Despite their empirical success, the
theoretical understanding of these methods in non-smooth settings, particularly
in Deep ReLU networks, remains limited. ReLU activations create exponentially
many region boundaries where standard smoothness assumptions break down.
\textbf{We derive the first
\(\tilde{O}\!\bigl(\sqrt{d_{\mathrm{eff}}/n}\bigr)\) generalization bound for
Adam in Deep ReLU networks and the first global-optimal convergence for Adam in
the non smooth, non convex relu landscape without a global PL or convexity
assumption.} Our analysis is based on stratified Morse theory and novel results
in Kakeya sets. We develop a multi-layer refinement framework that
progressively tightens bounds on region crossings. We prove that the number of
region crossings collapses from exponential to near-linear in the effective
dimension. Using a Kakeya based method, we give a tighter generalization bound
than PAC-Bayes approaches and showcase convergence using a mild uniform low
barrier assumption.",http://arxiv.org/abs/2505.15013v1
One-Layer Transformers are Provably Optimal for In-context Reasoning and Distributional Association Learning in Next-Token Prediction Tasks,"We study the approximation capabilities and on-convergence behaviors of
one-layer transformers on the noiseless and noisy in-context reasoning of
next-token prediction. Existing theoretical results focus on understanding the
in-context reasoning behaviors for either the first gradient step or when the
number of samples is infinite. Furthermore, no convergence rates nor
generalization abilities were known. Our work addresses these gaps by showing
that there exists a class of one-layer transformers that are provably
Bayes-optimal with both linear and ReLU attention. When being trained with
gradient descent, we show via a finite-sample analysis that the expected loss
of these transformers converges at linear rate to the Bayes risk. Moreover, we
prove that the trained models generalize to unseen samples as well as exhibit
learning behaviors that were empirically observed in previous works. Our
theoretical findings are further supported by extensive empirical validations.",http://arxiv.org/abs/2505.15009v1
Know When to Abstain: Optimal Selective Classification with Likelihood Ratios,"Selective classification enhances the reliability of predictive models by
allowing them to abstain from making uncertain predictions. In this work, we
revisit the design of optimal selection functions through the lens of the
Neyman--Pearson lemma, a classical result in statistics that characterizes the
optimal rejection rule as a likelihood ratio test. We show that this
perspective not only unifies the behavior of several post-hoc selection
baselines, but also motivates new approaches to selective classification which
we propose here. A central focus of our work is the setting of covariate shift,
where the input distribution at test time differs from that at training. This
realistic and challenging scenario remains relatively underexplored in the
context of selective classification. We evaluate our proposed methods across a
range of vision and language tasks, including both supervised learning and
vision-language models. Our experiments demonstrate that our
Neyman--Pearson-informed methods consistently outperform existing baselines,
indicating that likelihood ratio-based selection offers a robust mechanism for
improving selective classification under covariate shifts. Our code is publicly
available at https://github.com/clear-nus/sc-likelihood-ratios.",http://arxiv.org/abs/2505.15008v1
