title,abstract,url
GoT-R1: Unleashing Reasoning Capability of MLLM for Visual Generation with Reinforcement Learning,"Visual generation models have made remarkable progress in creating realistic
images from text prompts, yet struggle with complex prompts that specify
multiple objects with precise spatial relationships and attributes. Effective
handling of such prompts requires explicit reasoning about the semantic content
and spatial layout. We present GoT-R1, a framework that applies reinforcement
learning to enhance semantic-spatial reasoning in visual generation. Building
upon the Generation Chain-of-Thought approach, GoT-R1 enables models to
autonomously discover effective reasoning strategies beyond predefined
templates through carefully designed reinforcement learning. To achieve this,
we propose a dual-stage multi-dimensional reward framework that leverages MLLMs
to evaluate both the reasoning process and final output, enabling effective
supervision across the entire generation pipeline. The reward system assesses
semantic alignment, spatial accuracy, and visual quality in a unified approach.
Experimental results demonstrate significant improvements on T2I-CompBench
benchmark, particularly in compositional tasks involving precise spatial
relationships and attribute binding. GoT-R1 advances the state-of-the-art in
image generation by successfully transferring sophisticated reasoning
capabilities to the visual generation domain. To facilitate future research, we
make our code and pretrained models publicly available at
https://github.com/gogoduan/GoT-R1.",http://arxiv.org/abs/2505.17022v1
Delving into RL for Image Generation with CoT: A Study on DPO vs. GRPO,"Recent advancements underscore the significant role of Reinforcement Learning
(RL) in enhancing the Chain-of-Thought (CoT) reasoning capabilities of large
language models (LLMs). Two prominent RL algorithms, Direct Preference
Optimization (DPO) and Group Relative Policy Optimization (GRPO), are central
to these developments, showcasing different pros and cons. Autoregressive image
generation, also interpretable as a sequential CoT reasoning process, presents
unique challenges distinct from LLM-based CoT reasoning. These encompass
ensuring text-image consistency, improving image aesthetic quality, and
designing sophisticated reward models, rather than relying on simpler
rule-based rewards. While recent efforts have extended RL to this domain, these
explorations typically lack an in-depth analysis of the domain-specific
challenges and the characteristics of different RL strategies. To bridge this
gap, we provide the first comprehensive investigation of the GRPO and DPO
algorithms in autoregressive image generation, evaluating their in-domain
performance and out-of-domain generalization, while scrutinizing the impact of
different reward models on their respective capabilities. Our findings reveal
that GRPO and DPO exhibit distinct advantages, and crucially, that reward
models possessing stronger intrinsic generalization capabilities potentially
enhance the generalization potential of the applied RL algorithms. Furthermore,
we systematically explore three prevalent scaling strategies to enhance both
their in-domain and out-of-domain proficiency, deriving unique insights into
efficiently scaling performance for each paradigm. We hope our study paves a
new path for inspiring future work on developing more effective RL algorithms
to achieve robust CoT reasoning in the realm of autoregressive image
generation. Code is released at
https://github.com/ZiyuGuo99/Image-Generation-CoT",http://arxiv.org/abs/2505.17017v1
Interactive Post-Training for Vision-Language-Action Models,"We introduce RIPT-VLA, a simple and scalable reinforcement-learning-based
interactive post-training paradigm that fine-tunes pretrained
Vision-Language-Action (VLA) models using only sparse binary success rewards.
Existing VLA training pipelines rely heavily on offline expert demonstration
data and supervised imitation, limiting their ability to adapt to new tasks and
environments under low-data regimes. RIPT-VLA addresses this by enabling
interactive post-training with a stable policy optimization algorithm based on
dynamic rollout sampling and leave-one-out advantage estimation.
  RIPT-VLA has the following characteristics. First, it applies to various VLA
models, resulting in an improvement on the lightweight QueST model by 21.2%,
and the 7B OpenVLA-OFT model to an unprecedented 97.5% success rate. Second, it
is computationally efficient and data-efficient: with only one demonstration,
RIPT-VLA enables an unworkable SFT model (4%) to succeed with a 97% success
rate within 15 iterations. Furthermore, we demonstrate that the policy learned
by RIPT-VLA generalizes across different tasks and scenarios and is robust to
the initial state context. These results highlight RIPT-VLA as a practical and
effective paradigm for post-training VLA models through minimal supervision.",http://arxiv.org/abs/2505.17016v1
When Are Concepts Erased From Diffusion Models?,"Concept erasure, the ability to selectively prevent a model from generating
specific concepts, has attracted growing interest, with various approaches
emerging to address the challenge. However, it remains unclear how thoroughly
these methods erase the target concept. We begin by proposing two conceptual
models for the erasure mechanism in diffusion models: (i) reducing the
likelihood of generating the target concept, and (ii) interfering with the
model's internal guidance mechanisms. To thoroughly assess whether a concept
has been truly erased from the model, we introduce a suite of independent
evaluations. Our evaluation framework includes adversarial attacks, novel
probing techniques, and analysis of the model's alternative generations in
place of the erased concept. Our results shed light on the tension between
minimizing side effects and maintaining robustness to adversarial prompts.
Broadly, our work underlines the importance of comprehensive evaluation for
erasure in diffusion models.",http://arxiv.org/abs/2505.17013v1
Understanding Prompt Tuning and In-Context Learning via Meta-Learning,"Prompting is one of the main ways to adapt a pretrained model to target
tasks. Besides manually constructing prompts, many prompt optimization methods
have been proposed in the literature. Method development is mainly empirically
driven, with less emphasis on a conceptual understanding of prompting. In this
paper we discuss how optimal prompting can be understood through a Bayesian
view, which also implies some fundamental limitations of prompting that can
only be overcome by tuning weights. The paper explains in detail how
meta-trained neural networks behave as Bayesian predictors over the pretraining
distribution, whose hallmark feature is rapid in-context adaptation. Optimal
prompting can be studied formally as conditioning these Bayesian predictors,
yielding criteria for target tasks where optimal prompting is and is not
possible. We support the theory with educational experiments on LSTMs and
Transformers, where we compare different versions of prefix-tuning and
different weight-tuning methods. We also confirm that soft prefixes, which are
sequences of real-valued vectors outside the token alphabet, can lead to very
effective prompts for trained and even untrained networks by manipulating
activations in ways that are not achievable by hard tokens. This adds an
important mechanistic aspect beyond the conceptual Bayesian theory.",http://arxiv.org/abs/2505.17010v1
Guided Diffusion Sampling on Function Spaces with Applications to PDEs,"We propose a general framework for conditional sampling in PDE-based inverse
problems, targeting the recovery of whole solutions from extremely sparse or
noisy measurements. This is accomplished by a function-space diffusion model
and plug-and-play guidance for conditioning. Our method first trains an
unconditional discretization-agnostic denoising model using neural operator
architectures. At inference, we refine the samples to satisfy sparse
observation data via a gradient-based guidance mechanism. Through rigorous
mathematical analysis, we extend Tweedie's formula to infinite-dimensional
Hilbert spaces, providing the theoretical foundation for our posterior sampling
approach. Our method (FunDPS) accurately captures posterior distributions in
function spaces under minimal supervision and severe data scarcity. Across five
PDE tasks with only 3% observation, our method achieves an average 32% accuracy
improvement over state-of-the-art fixed-resolution diffusion baselines while
reducing sampling steps by 4x. Furthermore, multi-resolution fine-tuning
ensures strong cross-resolution generalizability. To the best of our knowledge,
this is the first diffusion-based framework to operate independently of
discretization, offering a practical and flexible solution for forward and
inverse problems in the context of PDEs. Code is available at
https://github.com/neuraloperator/FunDPS",http://arxiv.org/abs/2505.17004v1
Sufficient conditions for offline reactivation in recurrent neural networks,"During periods of quiescence, such as sleep, neural activity in many brain
circuits resembles that observed during periods of task engagement. However,
the precise conditions under which task-optimized networks can autonomously
reactivate the same network states responsible for online behavior is poorly
understood. In this study, we develop a mathematical framework that outlines
sufficient conditions for the emergence of neural reactivation in circuits that
encode features of smoothly varying stimuli. We demonstrate mathematically that
noisy recurrent networks optimized to track environmental state variables using
change-based sensory information naturally develop denoising dynamics, which,
in the absence of input, cause the network to revisit state configurations
observed during periods of online activity. We validate our findings using
numerical experiments on two canonical neuroscience tasks: spatial position
estimation based on self-motion cues, and head direction estimation based on
angular velocity cues. Overall, our work provides theoretical support for
modeling offline reactivation as an emergent consequence of task optimization
in noisy neural circuits.",http://arxiv.org/abs/2505.17003v1
Critical Points of Random Neural Networks,"This work investigates the expected number of critical points of random
neural networks with different activation functions as the depth increases in
the infinite-width limit. Under suitable regularity conditions, we derive
precise asymptotic formulas for the expected number of critical points of fixed
index and those exceeding a given threshold. Our analysis reveals three
distinct regimes depending on the value of the first derivative of the
covariance evaluated at 1: the expected number of critical points may converge,
grow polynomially, or grow exponentially with depth. The theoretical
predictions are supported by numerical experiments. Moreover, we provide
numerical evidence suggesting that, when the regularity condition is not
satisfied (e.g. for neural networks with ReLU as activation function), the
number of critical points increases as the map resolution increases, indicating
a potential divergence in the number of critical points.",http://arxiv.org/abs/2505.17000v1
A Unified Framework for Simultaneous Parameter and Function Discovery in Differential Equations,"Inverse problems involving differential equations often require identifying
unknown parameters or functions from data. Existing approaches, such as
Physics-Informed Neural Networks (PINNs), Universal Differential Equations
(UDEs) and Universal Physics-Informed Neural Networks (UPINNs), are effective
at isolating either parameters or functions but can face challenges when
applied simultaneously due to solution non-uniqueness. In this work, we
introduce a framework that addresses these limitations by establishing
conditions under which unique solutions can be guaranteed. To illustrate, we
apply it to examples from biological systems and ecological dynamics,
demonstrating accurate and interpretable results. Our approach significantly
enhances the potential of machine learning techniques in modeling complex
systems in science and engineering.",http://arxiv.org/abs/2505.16996v1
Native Segmentation Vision Transformers,"Uniform downsampling remains the de facto standard for reducing spatial
resolution in vision backbones. In this work, we propose an alternative design
built around a content-aware spatial grouping layer, that dynamically assigns
tokens to a reduced set based on image boundaries and their semantic content.
Stacking our grouping layer across consecutive backbone stages results in
hierarchical segmentation that arises natively in the feature extraction
process, resulting in our coined Native Segmentation Vision Transformer. We
show that a careful design of our architecture enables the emergence of strong
segmentation masks solely from grouping layers, that is, without additional
segmentation-specific heads. This sets the foundation for a new paradigm of
native, backbone-level segmentation, which enables strong zero-shot results
without mask supervision, as well as a minimal and efficient standalone model
design for downstream segmentation tasks. Our project page is
https://research.nvidia.com/labs/dvl/projects/native-segmentation.",http://arxiv.org/abs/2505.16993v1
"PICT -- A Differentiable, GPU-Accelerated Multi-Block PISO Solver for Simulation-Coupled Learning Tasks in Fluid Dynamics","Despite decades of advancements, the simulation of fluids remains one of the
most challenging areas of in scientific computing. Supported by the necessity
of gradient information in deep learning, differentiable simulators have
emerged as an effective tool for optimization and learning in physics
simulations. In this work, we present our fluid simulator PICT, a
differentiable pressure-implicit solver coded in PyTorch with
Graphics-processing-unit (GPU) support. We first verify the accuracy of both
the forward simulation and our derived gradients in various established
benchmarks like lid-driven cavities and turbulent channel flows before we show
that the gradients provided by our solver can be used to learn complicated
turbulence models in 2D and 3D. We apply both supervised and unsupervised
training regimes using physical priors to match flow statistics. In particular,
we learn a stable sub-grid scale (SGS) model for a 3D turbulent channel flow
purely based on reference statistics. The low-resolution corrector trained with
our solver runs substantially faster than the highly resolved references, while
keeping or even surpassing their accuracy. Finally, we give additional insights
into the physical interpretation of different solver gradients, and motivate a
physically informed regularization technique. To ensure that the full potential
of PICT can be leveraged, it is published as open source:
https://github.com/tum-pbs/PICT.",http://arxiv.org/abs/2505.16992v1
Extremely Simple Multimodal Outlier Synthesis for Out-of-Distribution Detection and Segmentation,"Out-of-distribution (OOD) detection and segmentation are crucial for
deploying machine learning models in safety-critical applications such as
autonomous driving and robot-assisted surgery. While prior research has
primarily focused on unimodal image data, real-world applications are
inherently multimodal, requiring the integration of multiple modalities for
improved OOD detection. A key challenge is the lack of supervision signals from
unknown data, leading to overconfident predictions on OOD samples. To address
this challenge, we propose Feature Mixing, an extremely simple and fast method
for multimodal outlier synthesis with theoretical support, which can be further
optimized to help the model better distinguish between in-distribution (ID) and
OOD data. Feature Mixing is modality-agnostic and applicable to various
modality combinations. Additionally, we introduce CARLA-OOD, a novel multimodal
dataset for OOD segmentation, featuring synthetic OOD objects across diverse
scenes and weather conditions. Extensive experiments on SemanticKITTI,
nuScenes, CARLA-OOD datasets, and the MultiOOD benchmark demonstrate that
Feature Mixing achieves state-of-the-art performance with a $10 \times$ to $370
\times$ speedup. Our source code and dataset will be available at
https://github.com/mona4399/FeatureMixing.",http://arxiv.org/abs/2505.16985v1
UFT: Unifying Supervised and Reinforcement Fine-Tuning,"Post-training has demonstrated its importance in enhancing the reasoning
capabilities of large language models (LLMs). The primary post-training methods
can be categorized into supervised fine-tuning (SFT) and reinforcement
fine-tuning (RFT). SFT is efficient and well-suited for small language models,
but it may lead to overfitting and limit the reasoning abilities of larger
models. In contrast, RFT generally yields better generalization but depends
heavily on the strength of the base model. To address the limitations of SFT
and RFT, we propose Unified Fine-Tuning (UFT), a novel post-training paradigm
that unifies SFT and RFT into a single, integrated process. UFT enables the
model to effectively explore solutions while incorporating informative
supervision signals, bridging the gap between memorizing and thinking
underlying existing methods. Notably, UFT outperforms both SFT and RFT in
general, regardless of model sizes. Furthermore, we theoretically prove that
UFT breaks RFT's inherent exponential sample complexity bottleneck, showing for
the first time that unified training can exponentially accelerate convergence
on long-horizon reasoning tasks.",http://arxiv.org/abs/2505.16984v1
"CASS: Nvidia to AMD Transpilation with Data, Models, and Benchmark","We introduce \texttt{CASS}, the first large-scale dataset and model suite for
cross-architecture GPU code transpilation, targeting both source-level
(CUDA~$\leftrightarrow$~HIP) and assembly-level (Nvidia
SASS~$\leftrightarrow$~AMD RDNA3) translation. The dataset comprises 70k
verified code pairs across host and device, addressing a critical gap in
low-level GPU code portability. Leveraging this resource, we train the
\texttt{CASS} family of domain-specific language models, achieving 95\% source
translation accuracy and 37.5\% assembly translation accuracy, substantially
outperforming commercial baselines such as GPT-4o, Claude, and Hipify. Our
generated code matches native performance in over 85\% of test cases,
preserving runtime and memory behavior. To support rigorous evaluation, we
introduce \texttt{CASS-Bench}, a curated benchmark spanning 16 GPU domains with
ground-truth execution. All data, models, and evaluation tools are released as
open source to foster progress in GPU compiler tooling, binary compatibility,
and LLM-guided hardware translation. Dataset and benchmark are on
\href{https://huggingface.co/datasets/MBZUAI/cass}{\textcolor{blue}{HuggingFace}},
with code at
\href{https://github.com/GustavoStahl/CASS}{\textcolor{blue}{GitHub}}.",http://arxiv.org/abs/2505.16968v1
BP-Seg: A graphical model approach to unsupervised and non-contiguous text segmentation using belief propagation,"Text segmentation based on the semantic meaning of sentences is a fundamental
task with broad utility in many downstream applications. In this paper, we
propose a graphical model-based unsupervised learning approach, named BP-Seg
for efficient text segmentation. Our method not only considers local coherence,
capturing the intuition that adjacent sentences are often more related, but
also effectively groups sentences that are distant in the text yet semantically
similar. This is achieved through belief propagation on the carefully
constructed graphical models. Experimental results on both an illustrative
example and a dataset with long-form documents demonstrate that our method
performs favorably compared to competing approaches.",http://arxiv.org/abs/2505.16965v1
Bigger Isn't Always Memorizing: Early Stopping Overparameterized Diffusion Models,"Diffusion probabilistic models have become a cornerstone of modern generative
AI, yet the mechanisms underlying their generalization remain poorly
understood. In fact, if these models were perfectly minimizing their training
loss, they would just generate data belonging to their training set, i.e.,
memorize, as empirically found in the overparameterized regime. We revisit this
view by showing that, in highly overparameterized diffusion models,
generalization in natural data domains is progressively achieved during
training before the onset of memorization. Our results, ranging from image to
language diffusion models, systematically support the empirical law that
memorization time is proportional to the dataset size. Generalization vs.
memorization is then best understood as a competition between time scales. We
show that this phenomenology is recovered in diffusion models learning a simple
probabilistic context-free grammar with random rules, where generalization
corresponds to the hierarchical acquisition of deeper grammar rules as training
time grows, and the generalization cost of early stopping can be characterized.
We summarize these results in a phase diagram. Overall, our results support
that a principled early-stopping criterion - scaling with dataset size - can
effectively optimize generalization while avoiding memorization, with direct
implications for hyperparameter transfer and privacy-sensitive applications.",http://arxiv.org/abs/2505.16959v1
A Comprehensive Evaluation of Contemporary ML-Based Solvers for Combinatorial Optimization,"Machine learning (ML) has demonstrated considerable potential in supporting
model design and optimization for combinatorial optimization (CO) problems.
However, much of the progress to date has been evaluated on small-scale,
synthetic datasets, raising concerns about the practical effectiveness of
ML-based solvers in real-world, large-scale CO scenarios. Additionally, many
existing CO benchmarks lack sufficient training data, limiting their utility
for evaluating data-driven approaches. To address these limitations, we
introduce FrontierCO, a comprehensive benchmark that covers eight canonical CO
problem types and evaluates 16 representative ML-based solvers--including graph
neural networks and large language model (LLM) agents. FrontierCO features
challenging instances drawn from industrial applications and frontier CO
research, offering both realistic problem difficulty and abundant training
data. Our empirical results provide critical insights into the strengths and
limitations of current ML methods, helping to guide more robust and practically
relevant advances at the intersection of machine learning and combinatorial
optimization. Our data is available at
https://huggingface.co/datasets/CO-Bench/FrontierCO.",http://arxiv.org/abs/2505.16952v1
ICYM2I: The illusion of multimodal informativeness under missingness,"Multimodal learning is of continued interest in artificial intelligence-based
applications, motivated by the potential information gain from combining
different types of data. However, modalities collected and curated during
development may differ from the modalities available at deployment due to
multiple factors including cost, hardware failure, or -- as we argue in this
work -- the perceived informativeness of a given modality. Na{\""i}ve estimation
of the information gain associated with including an additional modality
without accounting for missingness may result in improper estimates of that
modality's value in downstream tasks. Our work formalizes the problem of
missingness in multimodal learning and demonstrates the biases resulting from
ignoring this process. To address this issue, we introduce ICYM2I (In Case You
Multimodal Missed It), a framework for the evaluation of predictive performance
and information gain under missingness through inverse probability
weighting-based correction. We demonstrate the importance of the proposed
adjustment to estimate information gain under missingness on synthetic,
semi-synthetic, and real-world medical datasets.",http://arxiv.org/abs/2505.16953v1
